{
  "name": "tdmsscan",
  "description": "Inspecte la structure d'un fichier TDMS",
  "category": "utility",
  "executable": "tdmsscan",
  "parameters": {
    "required": [
      {
        "name": "INPUT_TDMS_FILE",
        "type": "file",
        "description": "Fichier TDMS à inspecter",
        "validation": {
          "file_extensions": [".tdms"]
        }
      }
    ],
    "optional": []
  },
  "inputs": [
    "Fichier TDMS"
  ],
  "outputs": [
    "Affichage des métadonnées et structure"
  ]
}
